{"receiptId":"resolution","blockerId":"blocker","provenance":"human-confirmed","actorLabel":"Leo","decision":"resume","scope":"task","changeId":"change","taskId":"task","taskRevision":1,"leaseGeneration":1,"artifactHashes":["aaaaaaaaaaaaaaaaaaaaaaaaaaaaaaaaaaaaaaaaaaaaaaaaaaaaaaaaaaaaaaaa"],"targetRecoveryState":"ready","timestamp":"2099-01-01T00:00:00.000Z","expiresAt":"2099-01-02T00:00:00.000Z"}
